{
  "$schema": "https://json-schema.org/draft/2020-12/schema",
  "$id": "https://kora.local/kora-stream-games/sessao.schema.json",
  "title": "Sessão de live",
  "description": "Efêmero. additionalProperties é false de propósito em toda a árvore: é o que impede alguém acrescentar nickname ou id de espectador no log sem passar por revisão. O log guarda tipo de presente, valor, delta e latência; nunca quem enviou. Ver 11_SEGURANCA, camada 4.",
  "type": "object",
  "additionalProperties": false,
  "required": [
    "sessaoId",
    "streamerId",
    "presetId",
    "iniciadaEm",
    "encerradaEm"
  ],
  "properties": {
    "sessaoId": {
      "type": "string",
      "pattern": "^\\d{4}-\\d{2}-\\d{2}T\\d{2}-\\d{2}-\\d{2}$"
    },
    "streamerId": {
      "$ref": "comuns.schema.json#/$defs/streamerId"
    },
    "presetId": {
      "$ref": "comuns.schema.json#/$defs/identificador"
    },
    "mapaId": {
      "oneOf": [
        {
          "$ref": "comuns.schema.json#/$defs/identificador"
        },
        {
          "type": "null"
        }
      ]
    },
    "iniciadaEm": {
      "$ref": "comuns.schema.json#/$defs/instante"
    },
    "encerradaEm": {
      "oneOf": [
        {
          "$ref": "comuns.schema.json#/$defs/instante"
        },
        {
          "type": "null"
        }
      ]
    },
    "plataformaReferencia": {
      "description": "Reportada pelo jogo via POST /jogo/estado. A ponte NUNCA calcula nem acumula posição. Ver R9. O teto é o mesmo de `totalPlataformas` em mapa.schema.json e estado-jogo.schema.json: sessão não pode ter teto menor que a torre que ela grava. Era 400 enquanto a torre era pequena, e o mapa no ar hoje tem 1000 — acima de 400 toda escrita da sessão passava a falhar, e o Stop derrubava a ponte antes de anular a sessão.",
      "type": "integer",
      "minimum": 0,
      "maximum": 5000
    },
    "plataformaMaxima": {
      "type": "integer",
      "minimum": 0,
      "maximum": 5000
    },
    "quedasNaturais": {
      "type": "integer",
      "minimum": 0
    },
    "naoMapeados": {
      "description": "Contagem de presente que chegou e não estava em nenhum slot (F2.4). Só contagem por presente, sem doador.",
      "type": "array",
      "items": {
        "type": "object",
        "additionalProperties": false,
        "required": [
          "presenteNome",
          "contagem"
        ],
        "properties": {
          "presenteNome": {
            "type": "string",
            "minLength": 1,
            "maxLength": 60
          },
          "moedas": {
            "type": "integer",
            "minimum": 0
          },
          "contagem": {
            "type": "integer",
            "minimum": 1
          }
        }
      }
    },
    "eventos": {
      "description": "Detalhe por evento. Existe só enquanto a sessão está aberta.",
      "type": "array",
      "items": {
        "$ref": "#/$defs/eventoAplicado"
      }
    },
    "resumo": {
      "$ref": "#/$defs/resumo"
    }
  },
  "allOf": [
    {
      "description": "Sessão encerrada é reduzida ao resumo agregado e o detalhe por evento é descartado (F5 e 11_SEGURANCA). Arquivo com encerradaEm preenchido e eventos dentro é vazamento, não é dado.",
      "if": {
        "required": [
          "encerradaEm"
        ],
        "properties": {
          "encerradaEm": {
            "type": "string"
          }
        }
      },
      "then": {
        "required": [
          "resumo"
        ],
        "properties": {
          "eventos": {
            "type": "array",
            "maxItems": 0
          },
          "resumo": {
            "$ref": "#/$defs/resumo"
          }
        }
      }
    }
  ],
  "$defs": {
    "eventoAplicado": {
      "type": "object",
      "additionalProperties": false,
      "required": [
        "em",
        "slot",
        "presenteId",
        "repeticoes",
        "delta",
        "animacaoId"
      ],
      "properties": {
        "em": {
          "$ref": "comuns.schema.json#/$defs/instante"
        },
        "slot": {
          "description": "Qual slot disparou, de 1 a 24 (o teto da R1 emendada). NULO quando o presente veio da tabela de movimento (ADR-016): ele moveu a torre sem ocupar slot nenhum, e o resumo por slot não o conta. O teto acompanha o do preset de propósito: parado em 6, um presente do slot 7 gravava um evento fora do contrato e a sessão INTEIRA falhava na hora do Stop, com a live já acabada.",
          "oneOf": [
            {
              "type": "integer",
              "minimum": 1,
              "maximum": 24
            },
            {
              "type": "null"
            }
          ]
        },
        "presenteId": {
          "$ref": "comuns.schema.json#/$defs/presenteId"
        },
        "repeticoes": {
          "type": "integer",
          "minimum": 1
        },
        "delta": {
          "type": "integer"
        },
        "animacaoId": {
          "$ref": "comuns.schema.json#/$defs/animacaoId"
        },
        "latenciaMs": {
          "type": "integer",
          "minimum": 0
        }
      }
    },
    "resumo": {
      "type": "object",
      "additionalProperties": false,
      "required": [
        "plataformaMaxima",
        "totalPresentes",
        "presentesPorSlot"
      ],
      "properties": {
        "plataformaMaxima": {
          "type": "integer",
          "minimum": 0,
          "maximum": 5000
        },
        "totalPresentes": {
          "type": "integer",
          "minimum": 0,
          "description": "Quantas ANIMAÇÕES o jogo tocou. NÃO é quantos presentes chegaram: presente que perde combate (ADR-012), que cai em cooldown ou que coalesce com outro vira um despacho só. Para julgar o portão da Fase 0 — 'os presentes aumentaram?' — use presentesRecebidos."
        },
        "presentesPorSlot": {
          "description": "Contagem por posição de slot, 1 a 24. A chave é texto porque é chave de objeto JSON; o padrão é o mesmo teto do preset, e mexer num sem mexer no outro quebra a gravação da sessão no Stop.",
          "type": "object",
          "additionalProperties": false,
          "patternProperties": {
            "^([1-9]|1[0-9]|2[0-4])$": {
              "type": "integer",
              "minimum": 0
            }
          }
        },
        "latenciaMediaMs": {
          "type": [
            "integer",
            "null"
          ],
          "minimum": 0
        },
        "quedasNaturais": {
          "type": "integer",
          "minimum": 0
        },
        "duracaoSegundos": {
          "type": "integer",
          "minimum": 0
        },
        "presentesRecebidos": {
          "description": "Quantos presentes a live entregou à ponte, antes de qualquer combate, cooldown ou casamento com slot. É este o número do portão da Fase 0. Ausente em sessão gravada antes de 2026-09-10, quando o campo passou a existir.",
          "type": "integer",
          "minimum": 0
        },
        "moedasRecebidas": {
          "description": "A soma das moedas dos presentes recebidos. O portão fala de volume de presente; moeda é o proxy de valor, e as duas contas podem andar em direções diferentes.",
          "type": "integer",
          "minimum": 0
        }
      }
    }
  }
}
